{
  "$schema": "https://github.com/AndreyKilanov/logfold/blob/main/docs/schema/mask-set.schema.json",
  "name": "pii",
  "version": 1,
  "description": "E-mail addresses, international phone numbers, payment card numbers (Luhn) and IBANs (mod 97).",
  "rules": [
    {
      "name": "email",
      "pattern": "\\b[A-Za-z0-9._%+-]+@[A-Za-z0-9-]+(?:\\.[A-Za-z0-9-]+)*\\.[A-Za-z]{2,}\\b",
      "token": "<EMAIL>"
    },
    {
      "name": "iban",
      "pattern": "\\b[A-Z]{2}\\d{2}(?:[A-Z0-9]{11,30}|(?: [A-Z0-9]{4}){2,7}(?: [A-Z0-9]{1,4})?)\\b",
      "token": "<IBAN>",
      "check": "iban"
    },
    {
      "name": "card",
      "pattern": "\\b(?:(?:4\\d{3}|5[1-5]\\d{2}|2[2-7]\\d{2}|35\\d{2}|6(?:011|[25]\\d{2}))[ -]\\d{4}[ -]\\d{4}[ -]\\d{4}|3[47]\\d{2}[ -]\\d{6}[ -]\\d{5}|3[068]\\d{2}[ -]\\d{6}[ -]\\d{4}|4\\d{15}|5[1-5]\\d{14}|2[2-7]\\d{14}|3[47]\\d{13}|35\\d{14}|3[068]\\d{12}|6(?:011|[25]\\d{2})\\d{12})\\b",
      "token": "<CARD>",
      "check": "luhn"
    },
    {
      "name": "phone",
      "pattern": "\\+(?:[1-9]\\d{0,2}(?:[ .-]|[ .-]?\\()(?:[ .()-]{0,2}\\d){6,13}|[1-9]\\d{9,14})\\b",
      "token": "<PHONE>"
    }
  ]
}
